id,applies_to_nation_input,applies_to_nation_output,reason
025d5222-9b79-4af7-b53a-6e93e0cbf58c,false,false,"The Youth Investment Fund is a program managed by the UK Government's Department for Digital, Culture, Media and Sport (DCMS), which primarily influences England. It does not directly apply to Scotland, where devolved powers mean that youth funding initiatives are managed by the Scottish Government."
004b85bc-9237-47cc-8fd4-a188abc24d0e,false,false,"This document pertains to the Environment Agency, which governs environmental matters in England. Therefore, it does not apply to Scotland, as environmental regulations are managed by the Scottish Environment Protection Agency (SEPA) in that nation."
02153dcc-bfb8-4fd8-a0c9-16cb295e669e,false,false,"This document pertains specifically to business rates in England. Scotland has its own separate system of non-domestic rates, managed differently from the business rates retention scheme established in England."
02240d74-47f4-47f2-8f60-716e0e1268d2,false,false,"The Local Authority Housing Fund is specific to England and does not apply to Scotland, which has separate housing policies and funding mechanisms."
02b5afc8-1e5f-453c-8f10-bb016bb6dd16,false,false,"This guidance is specifically tailored for local planning authorities (LPAs) in England, detailing the plan-making system under the Planning and Compulsory Purchase Act 2004, which does not extend to Scotland as planning regulations are devolved."
03205254-b703-4994-87bd-9c1e771e0105,true,false,"The document specifically pertains to a meeting of defense ministers from France, Germany, Italy, Poland, and the United Kingdom, focusing on European defense issues and does not have direct relevance or application to Scotland's governance or defense policy."
0099d8c0-a849-4bca-876c-80b9461fe69d,true,false,"The document specificially references the Office for Product Safety and Standards, which is primarily a body that operates within England. It does not address or apply to the distinct regulatory frameworks or agencies in Scotland."
03f06b09-6b60-43d6-8b16-80a78a6323ee,false,false,"This document pertains to the Environment Agency, which operates in England. Therefore, it does not apply to Scotland, as environmental regulations and permit applications in Scotland are managed by the Scottish Environment Protection Agency (SEPA)."
03a53b01-a063-4513-a03c-f3674f7b5bf2,false,false,"This document pertains to the Environment Agency, which is an English public body. Therefore, it does not apply to Scotland, as Scotland has its own separate environmental regulations and regulatory bodies, such as the Scottish Environment Protection Agency (SEPA)."
0156cb97-7f83-4b1c-80e0-ee80e2ffb676,false,false,"This document specifically pertains to the Northern Ireland Civil Service and does not apply to Scotland, as it is focused on pay statistics and trends relevant only to Northern Ireland."
0365346e-4852-49f5-a6bd-80885f074d60,true,false,"The document pertains to a bilateral agreement between the UAE and the UK, focusing on international finance laws and security which do not specifically address Scotland's devolved legal system or governance regarding illicit finance."
018c4186-5c11-40a3-9f7d-224d26e03da9,false,false,"The document specifically mentions that it covers England, Wales, and Northern Ireland, and does not include Scotland in the proposed changes to the Student Support for Higher Education statistics."
025da249-7afe-4f4e-a86e-c5cbd94d9419,false,false,"The document pertains specifically to the Environment Agency and environmental permits in England, which do not apply to Scotland as it has its own regulatory bodies and frameworks for environmental matters."
0253e362-f554-452a-9675-354d5e755acb,true,true,"The LCREE Survey pertains to the UK's overall approach to low carbon and renewable energy, which includes policies and statistics relevant to Scotland's energy transition efforts. Therefore, it applies to Scotland."
01c3477a-e7f3-4d5d-9cee-a3d0e03ef9b0,false,false,"This document pertains to the Environment Agency, which operates in England. It does not apply to Scotland, where water management is governed by separate legislation and agencies."
0292e559-e070-47ff-9c00-bea93c38864f,true,false,"The Immigration Rules apply to the whole UK, but specific variations exist for Scotland regarding devolved matters. This document pertains to UK-wide immigration policy and does not specifically address Scottish devolved areas."
01c3812c-c8c0-41c5-89e9-11fb5c793874,true,true,"The document specifically mentions the block grants for the Scottish Government, indicating its relevance and applicability to Scotland."
031533ef-12f0-40e5-be57-5ffbb6f5c317,true,false,"This document pertains to patent law and policy announcements which are specific to the UK and do not apply exclusively to Scotland, as intellectual property is a reserved matter under UK law."
03fdc129-ef49-4bf5-9603-db015f3d6b23,false,false,"The notice is specific to the Mercian Educational Trust, which operates in England, and does not apply to Scotland or other nations of the UK."
026f3e2a-5ffa-40cf-b155-99255fac26d5,true,true,"This document applies to Scotland as it deals with the importation of live animals and germinal products, which are regulated under both devolved and reserved matters in the UK. Animal welfare and import regulations are aspects managed by the Scottish Government."
035d941d-52e9-4239-aeab-306fcfae22b1,true,false,"This document does not specifically relate to Scotland as it focuses on economic statistics sector classification for the UK as a whole, without any distinct references or implications for Scottish statistical practices."
037bfd5d-8fe1-45e9-b667-f0dd58e3531c,true,false,"The document pertains specifically to the England and Wales jurisdiction, focusing on regulatory frameworks established under UK energy legislation and does not apply to Scotland, where energy regulation follows different devolved powers."
03d4b58a-abbd-4da2-8a12-44b2db6e4d00,false,false,"The document specifically addresses Derbyshire County Council, which is located in England, and does not pertain to Scotland."
0080275c-3110-4328-83f5-d23cc3d674f6,false,false,This document specifically pertains to the further education sector in Northern Ireland and does not apply to Scotland.
00c5e96a-7213-4f7a-a7c4-b09776adcb0c,true,false,"The Ministry of Housing, Communities and Local Government (MHCLG) primarily operates in England, and its reports and accounts are relevant only to English local governments and communities. Scotland has its own separate legislative framework and government departments for housing and local government matters."
04054976-e081-4688-a854-b8d3c73810f7,true,false,This document specifically relates to Defra's metrics for England's overseas development assistance programming and does not include provisions or guidance relevant to Scotland.
02a9ad17-4003-4b27-92e8-19a3dfe60af3,true,false,"The Company Names Tribunal operates under the Companies Act 2006, which applies primarily to England and Wales. Scotland has its own legal framework for company registration and name disputes, so this decision does not pertain to Scotland."
01297400-f487-435c-8629-1059ac44160d,false,false,"This document pertains to an environmental permit issued by the Environment Agency, which governs England. It does not apply to Scotland, as environmental regulation is managed separately by the Scottish Environment Protection Agency (SEPA)."
00016e76-dfd5-4eee-a124-c1b7c27afa92,true,false,"This document relates specifically to the Department for Digital, Culture, Media and Sport (DCMS) and its spending practices in England. It does not apply to Scotland as it does not pertain to devolved matters handled by the Scottish Government."
0179a59c-b447-4c3f-8177-4ec0cfabd2d8,false,false,"The document pertains specifically to employment vacancies notified to the Department for Communities (DfC) in Northern Ireland, and does not apply to the other nations of the UK including Scotland."
0151ed6a-bc2e-48ff-bc79-ad25dccbe33e,false,false,"This document specifically pertains to strategic licences developed by Natural England, which operates in England only. It does not apply to Scotland, where different wildlife regulations and licensing processes are in place, managed by NatureScot."
029a7703-3c72-4cff-91e7-e2b0a5e8dd1f,true,false,"This document pertains to the regulations and consent processes specific to England and does not apply to Scotland, which has separate legal frameworks and regulations regarding genetically modified organisms."
0234f250-1a64-4962-914b-fa5f4a015e93,true,false,"The document pertains specifically to the Competition and Markets Authority (CMA), which operates across the UK, but the meeting minutes themselves do not indicate a specific application to Scotland or any other nation."
01fe9387-3236-4e95-97ae-8074e3376dae,false,false,"This document pertains to an environmental permit issued by the Environment Agency, which is relevant only to England and does not apply to Scotland."
000707eb-acc0-437f-93fe-ec886e661151,false,false,"This document pertains to environmental permit applications regulated by the Environment Agency, which operates in England only. It does not apply to Scotland, as environmental permitting in Scotland is overseen by the Scottish Environment Protection Agency (SEPA). Therefore, it is specific to England and does not extend to Scotland."
00e145da-2f35-41ac-bfe6-927144c9189e,true,false,"The Community Infrastructure Levy (CIL) is primarily relevant to England and Northern Ireland, while Scotland has its own planning and infrastructure funding mechanisms, such as Section 75 agreements."
02309ebc-2e0e-4042-9808-d8e2d836c97d,true,true,"The guidelines established by the International Council for Harmonisation (ICH) are relevant across the UK, including Scotland, as they involve the regulatory standards for pharmaceuticals which are administered by the Medicines and Healthcare products Regulatory Agency (MHRA). Scotland, being part of the UK, adheres to these guidelines for drug registration and safety."
01e05d1e-ccb0-4afc-899c-b9f651f1f98b,false,false,"The document pertains to a development consent order made under the Planning Act 2008, which primarily applies to England. Scotland has its own separate planning legislation and processes, thus this document does not apply to Scotland."
03062492-908f-44f9-bdc5-43d946b4c539,true,false,"The document pertains specifically to bilateral ministerial consultations between Australia and the UK, and does not have direct implications or relevance to Scotland or its governance."
0266c327-2415-4dfa-a518-929e1dcbe962,false,false,"This document pertains to the Environment Agency, which operates in England only. Environmental regulations and permit applications in Scotland are managed by the Scottish Environment Protection Agency (SEPA), making this advertisement not applicable to Scotland."
02e5c543-73be-4c2f-a69e-a607467d29f4,false,false,"This document pertains to the Environment Agency, which operates in England. It does not apply to Scotland, as water management is devolved to the Scottish Government and its agencies."
008fd006-f7f3-4a6f-aa8a-3afdf6358c3c,true,false,This guidance specifically pertains to sending parcels from Great Britain to Northern Ireland and does not apply to Scotland as a separate nation. It focuses on the logistics and regulations set for cross-border trade between Great Britain and Northern Ireland.
0006fd09-ef2a-4344-8392-ec2d2e1df4b5,true,true,"The Animals (Scientific Procedures) Act 1986 applies across the entire UK, including Scotland, as it is a piece of UK legislation that governs the use of animals in scientific procedures."
01914c53-911f-449c-9b41-6b6ceedb2875,true,false,"The Companies Act 2006 applies to England and Wales, and does not have jurisdiction in Scotland, where company law is governed by different legislation."
000d51ae-0eed-4ced-bc92-23272551d7de,true,false,"The document pertains to occupational defined benefit pension schemes, which are primarily regulated under UK-wide laws, but specific regulations vary by nation. Scotland has its own pension regulations that may not be fully represented in this UK-focused overview."
02c5e740-e820-4f56-b7f6-0c744a301f70,false,false,"This document pertains to the Environment Agency, which operates in England only. Environmental permit applications and associated regulations are distinct in Scotland, where the Scottish Environment Protection Agency (SEPA) is responsible for similar matters."
018fab18-486a-4922-850f-4766673018b2,true,true,"The Industrial Strategy applies to Scotland as it is part of the UK's overarching economic framework, affecting business investment across all UK nations. While Scotland has its own devolved government and may tailor some policies, the strategy's goals align with enhancing the overall economy, including Scottish businesses."
0360ccde-8393-41d8-8931-df4c361b83ce,false,false,"This decision pertains to a teacher employed in England, specifically under the regulations applicable in England. The Teachers’ Disciplinary (England) Regulations 2012 govern the process, and therefore it does not apply to Scotland."
0202dcd1-328f-4a59-b40c-4ea258fb467a,false,false,"This document specifically pertains to a situation involving the Housing Ombudsman in relation to a housing association operating in England, and it does not extend to Scotland where different governance and housing regulation bodies exist."
0090472f-5264-4f97-9c45-aafa760c3e91,true,false,"The guidance on Extended Producer Responsibility (EPR) and the associated waste packaging assessments primarily applies to England and Wales, as it is part of UK-wide initiatives that predominantly follow regulations set by England and Wales, with differing regulations in Scotland."
0159b959-578e-4522-bd0d-e81eef29dc9b,false,false,"This document specifically pertains to Northern Ireland and does not apply to Scotland, as legal systems and court processes differ between the two nations."
0355267c-df32-443e-b4c3-afa1a8a6fd4a,false,false,"This document pertains to a planning appeal in England, specifically Slough, and does not apply to Scotland as planning laws and processes differ between the two nations."
03c7358b-5083-4a75-8f0d-a936eb09b198,false,false,"This document specifically pertains to private registered providers of social housing in England and does not apply to Scotland, which has its own housing regulations and providers."
0202616c-d2aa-4cd5-9a3f-ee15b6873f54,false,false,"This document pertains to an environmental permit application regulated by the Environment Agency, which operates in England only. Therefore, it does not apply to Scotland."
01938767-18df-4b84-b3f9-476603745ea9,true,false,"This decision pertains to a dispute under the Companies Act 2006, which primarily applies to England and Wales. Scottish company law is governed by separate legislation, thus this specific decision does not apply to Scotland."
02c4d7d8-262c-469d-a28d-b0080d215601,false,false,"This document pertains specifically to the Planning Act 2008 as it relates to Nationally Significant Infrastructure Projects in England and does not apply to Scotland, which has its own distinct planning framework and legislation."
0262f0fd-d358-4bca-80bc-3baecfaa69fe,true,true,"The document relates to international trade statistics, which apply to the UK as a whole, including Scotland, as trade policies and statistics are managed at the UK level."
03afafd2-2990-4cf1-8965-a987ca26457f,true,false,"The document specifically addresses the UK semiconductor sector and national strategies, which do not focus on Scotland's devolved powers or specific industry impacts in Scotland."
0386e83c-6fc4-4d1e-80fa-e5e8a25f7769,true,false,"This document pertains specifically to FOI/EIR requests handled by the VMD, which operates under UK government jurisdiction and may not cover Scotland's separate information access legislation."
00307922-1903-45f8-a2e4-cf31801cb5f2,true,false,"The document specifically discusses the Private Healthcare Information Network (PHIN) and its compliance with the Competitive Markets Authority (CMA) regulations, which primarily pertain to England's healthcare system. There is no indication that this compliance or the activities of PHIN extend to Scotland's distinct healthcare framework."
01498be5-9422-46e5-89bf-1ff6c6b5dac8,true,false,"This document pertains to the classification of goods under the UK's customs regulations and specifically addresses Northern Ireland practices, which may not apply directly to Scotland due to differences in customs and trade regulations following Brexit."
02d66964-d05b-45d8-8e23-f1686ba35911,false,false,"This document pertains to the Environment Agency, which operates in England only. It does not apply to Scotland, as environmental regulation there is managed by the Scottish Environment Protection Agency (SEPA)."
020e64e8-d1ae-40a6-bae6-24c4345c5d8b,false,false,"This document pertains to planning permission in England, specifically regarding sites in Lancashire, and does not apply to Scotland."
00fbcdb5-fa47-496c-83f0-df6553b65e76,true,true,"The statistics on patents, trade marks, and designs apply to Scotland as these intellectual property rights are regulated under UK law and impact all UK nations, including Scotland."
00656799-193c-4f19-ab36-5814c1fa14ab,false,false,This document focuses on value for money metrics and reporting within the context of registered providers which primarily applies to England. It does not directly address the specific frameworks or regulations in place for Scotland.
026926b2-70f0-4662-a797-c14585d6afad,true,false,"This document specifically pertains to individual insolvency statistics in England and Wales, and does not include information relevant to Scotland."
037b7955-bdbe-4eb4-bdf0-48b1e3227ee3,true,false,The document specifically relates to Northern Ireland and does not include information applicable to Scotland.
0177e16c-f8ec-46a9-acfb-ffb4f3001284,true,false,"This document primarily addresses tax system measures that are specific to England and may not pertain to Scotland, which has its own devolved tax powers and framework."
0130bf8f-33b5-4470-87a7-0ab42bc0a4e0,false,false,"The report specifically addresses youth justice services and public disorder incidents that occurred in England, and there is no indication that it includes or is relevant to the specific context or legal frameworks of Scotland."
0331e62e-bc2d-44bd-9977-6f53050bfa4f,false,false,"The document pertains specifically to the Electricity Works (Environmental Impact Assessment) Regulations that apply to England and Wales only, and does not include provisions or applications relevant to Scotland."
00bdfd0e-687e-4805-ba2c-27bbc512de8a,false,false,"The application pertains to the Planning Act 2008, which applies specifically to England. The decision regarding the Dogger Bank Teesside A / Sofia Offshore Wind Farm does not affect Scotland, as Scotland has its own planning system and regulatory framework for offshore wind projects."
03d18c46-0aec-4714-b817-5494b9da0d65,true,true,"The document discusses health services, including mental health support, which are applicable in Scotland as they are part of the devolved healthcare system managed by the Scottish Parliament."
0411fa78-11a7-4d85-9409-506df2fe7648,false,false,"The document pertains to Natural England, which is an England-specific agency. Therefore, it does not apply to Scotland."
014f6b85-0eb5-4707-bd45-8b9e0c62bf89,false,false,"This document pertains to a planning appeal in England, specifically in Reading, Berkshire. It does not apply to Scotland as planning regulations and processes differ significantly, with separate governance and planning systems in place."
02456bc8-9489-4ea1-ab22-3c6318b7f786,true,true,"The report covers seabird population trends in Britain and Ireland, which includes Scotland. As seabird populations are monitored across the entire UK, the findings and implications are relevant to Scotland."
037ae6cc-cf3d-4573-a3d5-d2e294629692,true,true,"The life tables data is relevant for the entire UK, including Scotland, as it provides statistical insights on demographic trends crucial for public policy and planning across all nations."
02f4de4f-9f17-40dd-b078-710d8ed04768,true,false,"This document is related to HMRC, which primarily operates in England, Wales, and Northern Ireland. Scotland has its own tax authority, Revenue Scotland, which administers devolved taxes; thus, this report does not apply to Scotland."
012ff780-ff9d-4ec8-b3ec-5afab3dd69f1,true,false,"The Wider Service Medal (WSM) is specific to Ministry of Defence personnel and armed forces veterans of the UK, which primarily pertains to England, Wales, and Northern Ireland's military operations. Scotland has its own distinct military and veteran frameworks that may not be aligned with this document."
040d5845-c832-4a65-8190-94863a55d506,false,false,"This document pertains specifically to the Environment Agency's processes in England for environmental permit applications, and does not apply to Scotland, where environmental regulation is managed by the Scottish Environment Protection Agency (SEPA)."
0163a2e1-1f30-4b28-8a27-4162df90eb49,false,false,"This document pertains to the Environment Agency, which regulates England specifically. Environmental permits and related activities are managed differently in Scotland by the Scottish Environment Protection Agency (SEPA), thus this particular document does not apply to Scotland."
038e105b-66e1-4a53-8afc-0e2ffe22bafe,true,true,"The document pertains to the National Referral Mechanism (NRM) for modern slavery, which is a UK-wide system applicable in all nations, including Scotland."
00debca0-9849-44a5-8451-60235654b426,false,false,The document specifically addresses the national wheelchair data collection for NHS services in England and does not pertain to healthcare policies or practices in Scotland.
029ecd26-6bfa-4fea-854c-756c71b41832,true,false,"This document pertains specifically to an agreement between the UK and Croatia regarding investment protections, which is a matter of foreign policy and trade agreements, not within the devolved powers of the Scottish Government."
01821d76-8ebc-4e40-b192-03aac0fe4a2e,false,false,"This document pertains specifically to environmental permit applications managed by the Environment Agency, which operates in England only. Therefore, it does not apply to Scotland."
026b106f-a764-4954-87ab-855a33baba6e,true,false,"The Civil Service Commission primarily operates within the context of the UK Civil Service, which does not encompass Scotland's devolved administration. Scotland has its own Civil Service arrangements and governance, therefore this report does not apply to Scotland."
030dac71-1cc5-4077-a481-d5c6241cd5b8,false,false,"The document pertains to Natural England, which is an agency in England. Therefore, the proposals and outcomes discussed do not apply to Scotland."
01599106-60bb-4d1f-858d-cde0b70a676c,true,false,"The guidance specifically addresses export controls related to Russia and does not apply directly to Scotland, as trade and export regulations are reserved matters handled by the UK government, encompassing all nations within the UK."
02c728a8-745c-4447-a892-b56ca101655c,false,false,"This document pertains to the Environment Agency, which operates in England only. Therefore, it does not apply to Scotland."
0154c30e-fa1f-4fe8-8235-ae44141f9c8c,true,false,"This update on Making Tax Digital for Income Tax applies only to England, Wales, and Northern Ireland. Scotland has devolved powers over tax and operates its own tax system, separate from the UK system."
026fbd3c-be0f-497e-ace0-1712a8887912,true,true,"This document applies to Scotland as it discusses official statistics relevant to Great Britain, which includes Scotland. It emphasizes impartiality in the production of statistics, a principle that is upheld across the UK, including in Scotland."
01d508d6-1be3-436b-892a-f0d94909c4b6,true,false,"The document specifically references 'Great Britain,' which includes England, Wales, and Scotland. However, as it concerns retail sales statistics that are typically managed separately, these statistics may not reflect all aspects of Scottish retail sales as reported by the Scottish Government."
028fd9cf-9b72-49a3-a38e-5aed629576be,true,false,"The document pertains specifically to the UK digital identity framework, which is managed by the Office for Digital Identities and Attributes (OfDIA) under a UK government department. While it mentions UK-wide applicability, Scotland has its own separate legal framework for data and identity matters, making this report primarily relevant to England, Wales, and Northern Ireland."
0252fc60-25bf-43ea-b808-ed24bd2492d4,false,false,The report specifically focuses on the findings for England and does not include data or analysis relevant to Scotland or other UK nations.
02ee0f15-1411-47d1-959a-56f4f161ed75,true,true,"The statistics on investment in intangible assets apply to the whole UK, including Scotland, as they are relevant to economic indicators and business performance across all nations within the UK."
037a5d4d-147b-4de3-bf0c-826ee20bafdf,false,false,"This document pertains to the Environment Agency and regulatory practices relevant to England, specifically relating to industrial emissions. It does not apply to Scotland, which has its own separate environmental regulatory body, the Scottish Environment Protection Agency (SEPA)."
039a30e0-c056-4a4b-bd80-3fa933aa6ba7,false,false,"This document pertains to rent regulations issued by the Department for Levelling Up, Housing and Communities, which is specific to England. Scotland has its own distinct housing policies and regulations managed by the Scottish Government, making this document inapplicable to Scotland."
