id,applies_to_nation_input,applies_to_nation_output,reason
b4e71a3d-2fc0-4b18-9b93-e95f7e26c622,false,false,"The document outlines policies specific to the Ministry of Justice in England and Wales, focusing on judicial office holders, which does not extend to the unique legal frameworks and judicial systems in Scotland."
771725ad-76ad-43e3-a74c-73b8262f1d32,false,false,"This document pertains to a planning application and decision relevant to England, as it describes infrastructure development typical under English planning law and regulations."
45a5799e-30df-4283-96b6-962037c5802a,false,false,"The document relates to an application for a water abstraction licence made to the Environment Agency, which is specific to England. It references specific locations and regulations that apply only within England and does not pertain to Scottish water management or law."
9328670c-d2c7-439a-a33a-a79d6678489e,false,false,"This document pertains specifically to applications under the Environmental Permitting Regulations 2016, which apply only to England and Wales. It does not apply to Scotland, as Scotland has its own separate environmental permitting regulations and governing bodies."
91cc2e93-9775-46a7-8295-2b634d6f7130,false,false,"The GRADE data sharing project specifically pertains to educational data systems in England and does not include data or frameworks relevant to Scotland's educational system, which operates independently."
5073ecf9-23ff-454b-9cd1-d4a787088be0,false,false,"This document pertains specifically to the Environmental Permitting (England and Wales) Regulations, which do not apply to Scotland as it operates under different environmental regulations."
cd74ac67-7b8f-4aba-8a62-38cf12d7edcb,false,false,"This report specifically pertains to England and mentions regulations and monitoring related to English rivers and estuaries. Scotland has its own separate legislative and environmental monitoring frameworks, and therefore this report does not apply to Scotland."
cfde7ef5-47ca-432c-93e7-4d84fb4b2349,false,false,"The document pertains specifically to environmental permitting under regulations applicable solely to England and Wales, and does not relate to Scottish regulations or authorities."
d2986e22-5ee1-43f7-badf-7dbb3beeeb8b,false,false,This document relates to building safety remediation specific to England and does not include provisions or details applicable to the building safety regulations or enforcement actions in Scotland.
d758defd-d097-47c1-af4c-bb9982505f36,false,false,"The planning application pertains specifically to a site in Bristol, England. Therefore, it does not apply to Scotland as planning regulations and procedures are distinct to each nation within the UK."
1dc26894-3460-4f28-bf41-e90be7f32cc8,false,false,"This document pertains specifically to the Environmental Permitting (England and Wales) Regulations 2016, and does not apply to Scotland, which has its own separate regulatory framework for environmental permits."
ced85597-41f8-40f5-a291-1da74374062a,false,false,This document specifically refers to attainment statistics for pupils in schools in England and does not include information or data relevant to Scotland.
c2974167-2031-42e4-8fd4-d84681c7422e,false,false,"This document primarily addresses aspects of healthcare administration and vaccine distribution, which are typically managed differently across the UK nations, particularly in Scotland where healthcare is devolved. Therefore, the specific content may not apply uniformly to Scotland."
50752786-1ccf-470d-843e-9d32c6e74b7a,false,false,"This document pertains specifically to the Environmental Permitting (England and Wales) Regulations 2016, which only apply to England and Wales. Scotland has its own separate environmental regulatory framework."
93401ff1-11d3-40ad-8a8e-af3aa79832d4,false,false,"This document concerns the Environment Agency, which operates in England only. Therefore, it does not apply to Scotland."
248a6b88-621b-4500-b966-9ab9d78d0cf2,false,false,"This document pertains to a permit issued by the Environment Agency, which regulates environmental matters in England. It does not apply to Scotland as environmental regulation is managed by the Scottish Environment Protection Agency (SEPA) in that nation."
55ba49d1-1f93-448c-99f6-6fff1039ede4,false,false,"This document pertains primarily to the operational and procedural matters of the UK Ministry of Justice and associated organizations, which operate mainly in England and Wales. It does not address issues specific to Scotland or involve Scottish authorities."
4e036101-18de-4dbc-b678-f7deed3d6ad3,false,false,"This document pertains specifically to environmental permitting under regulations that apply only to England and Wales, thereby excluding Scotland."
45c567c9-7eed-403a-beb9-0567db9de536,false,false,"The document pertains specifically to the Environmental Permitting (England and Wales) Regulations 2016, which do not apply to Scotland, as it has separate environmental legislation and regulatory bodies."
78d37b50-3e09-4ee2-b560-a884e59f559a,false,true,"The definition of 'children in need' is based on the Children Act 1989, which is applicable to England and Wales. However, Scotland has its own legislation regarding child welfare and protection, which makes this document not applicable to Scotland."
ca59646f-4e31-4801-9837-1490e04d2df6,true,false,"This document pertains specifically to the Department for Work and Pensions and Child Maintenance Group, which operate within England and does not have direct applicability or governance in Scotland."
f0026097-11cf-4dd0-91d4-7df133e5f393,false,false,"This document pertains to the Education Secretary for England and discusses matters specifically relevant to the education system in England, and does not apply to Scotland or other UK nations."
46153646-cba3-4b92-8965-634cace43a7a,false,false,"This document pertains to the Environment Agency, which operates in England. It does not apply to Scotland as Scotland has its own environmental regulatory body, the Scottish Environment Protection Agency (SEPA), responsible for similar matters."
579ca1b6-6764-4c74-b47a-9de2d323da99,false,false,"This document pertains specifically to Westward Housing Group Limited, which operates in South West England. There is no mention of any operations or regulations that apply specifically to Scotland."
f7357e0b-5f48-4e2f-9d44-65c9a2f0f165,false,true,"The document applies to Scotland because it mentions that similar responsibilities for the Deposit Return Scheme (DRS) will apply there, and notes that the Scottish Government will introduce separate legislation for the scheme."
c4e2ddba-435d-4ed1-b566-148dedb517c0,true,true,"The document discusses the processing of personal data related to veterinary and food safety roles, which are applicable in Scotland as part of the devolved agricultural and public health responsibilities. The cooperation with the Scottish Government indicates its relevance."
a2d4323c-bf0f-49ec-8d83-f51f709b71e7,true,false,"This document pertains to an internal process related to the CAC (Central Arbitration Committee) and does not specifically address legislation or policies applicable to Scotland. It primarily deals with procedures that may be relevant in England and potentially Wales, but Scotland has its own legal and arbitration framework."
87c254b3-5a40-4e1c-8761-e46d3e03b8e3,true,false,"The document pertains to changes specifically within the benefit system managed by the Department for Work and Pensions (DWP), which is responsible for England, Wales, and Northern Ireland. Scotland has its own devolved welfare system and benefits administration, making the content of this document not directly applicable to Scotland."
91d47623-6b58-4dbd-a87d-3eabef1c0fa5,false,false,"The document specifically focuses on influenza vaccine uptake among school-aged children in England, and does not address or mention regulations, data, or health policies in Scotland."
268a1397-6f1e-498c-a519-20dd7b000a11,true,true,"The Capacity Market operates across Great Britain, which includes Scotland. As energy policy and security of supply are devolved matters, changes in the Capacity Market may impact Scotland's energy landscape, requiring consideration of the local context and regulations."
46dfaab8-91ad-42da-9a1c-0c272eae9727,false,false,"This document specifically pertains to the stock and rents of social housing in England, as regulated by the Regulator of Social Housing, and does not include data or regulations relevant to Scotland's housing framework."
88faaba5-c18f-42e1-b6c2-38dc62bc5c71,false,false,"This document specifically pertains to the Environment Agency, which operates exclusively in England. Therefore, it does not apply to Scotland."
7dc430f8-72ed-4b7f-a3f4-d238c8ac3d41,false,true,"The Forestry Commission operates in Scotland and collaborates on forestry initiatives, making this educational program relevant for students in Scotland as well as the rest of the UK."
690cede6-deb9-47d0-923f-a1171288e10c,false,false,"The document exclusively reports on agricultural indicators and assessments specific to England, with no mention of Scotland's agricultural policies, practices, or data. Therefore, it does not apply to Scotland."
f66df372-5205-476f-9689-2c6d91e92a32,false,false,"This document does not reference any specific policies or regulations that apply to Scotland, focusing instead on bodies and roles within Ofqual and the Department for Education, which are primarily relevant to England."
f916bd8c-2338-423f-9e27-8f0aadfef54d,false,false,"This document pertains specifically to the Environment Agency, which operates in England and does not cover Scotland, as it has its own environmental regulatory body, the Scottish Environment Protection Agency (SEPA)."
e5ef8b55-3276-47e4-945e-73e0ea822f6b,false,false,"The Environment Agency is an organization specific to England, and its regulations and public consultation processes do not apply to Scotland, which has its own separate regulatory framework, primarily managed by the Scottish Environment Protection Agency (SEPA)."
b07afaf7-fba3-4a83-ae7b-c1cf11cf7965,false,false,"This document pertains to England as it specifically references the Environment Agency, which operates solely in England. It does not apply to Scotland, where separate regulations and a different agency, the Scottish Environment Protection Agency (SEPA), manage environmental issues."
fe70e336-bcee-40eb-8a4a-2fdde185b26c,false,false,"This document pertains to post-16 education and training statistics in England and does not include specific data or applicability for Scotland, which has its own distinct education system and reporting structures."
55d59cdd-b6c0-4ad8-a58b-9c042dae69c6,false,false,"This document pertains specifically to the local authority of Brighton and Hove City Council, which is located in England. It does not apply to Scotland as it is governed by different education regulations and systems."
163d4a91-441a-41e3-a30b-4899cf837986,false,false,"The document pertains specifically to the Environment Agency in England and Wales, which suggests it does not apply to Scotland, where environmental permitting is handled by the Scottish Environment Protection Agency (SEPA)."
fd7c1ab2-ddaa-42e2-a326-fc0d473d51a8,false,false,"The document specifically pertains to environmental noise regulation and mapping in England, as managed by Defra (the Department for Environment, Food & Rural Affairs). Scotland has its own distinct environmental regulations and frameworks, and this document does not apply to Scotland."
6163ae57-24a1-4e19-9da9-a84c360d994b,false,false,This document pertains specifically to environmental permitting regulations in England and Wales and does not apply to Scotland. Scotland has its own separate environmental regulations and governing bodies.
23bbaa5c-a9ad-4497-ab06-bca0b4cfb020,false,false,"The Litigation Funding Agreements (Enforceability) Bill explicitly states that it will apply to England and Wales only, therefore it does not apply to Scotland."
1972b04d-f566-4dd6-bd94-8c78e8182fdf,false,false,"This document pertains to the Environment Agency, which operates in England only. The regulatory framework for environmental matters, including public consultations on permits, differs in Scotland, where it is managed by the Scottish Environment Protection Agency (SEPA)."
edb28cba-6d79-4342-9382-89c65d680de1,false,false,"This document specifically references the Environment Agency, which operates in England only. Therefore, it does not apply to Scotland, where decisions on environmental matters fall under the Scottish Environment Protection Agency (SEPA)."
9dc88516-f9f1-41c6-97b0-c6d7ccfe2c8a,false,true,"This document applies to Scotland as it provides information relevant to health and social care (HSC) vacancies which are pertinent to recruitment efforts across various regions, including Scotland, as part of the broader UK health system."
d4b74d4b-42db-4c3a-8970-7d3593aca577,false,false,"This document pertains to a charity registered in England and addresses governance issues under the Charities Act 2011, which is specific to England and Wales. It does not apply to Scotland, which has its own charity regulatory framework under the Office of the Scottish Charity Regulator (OSCR)."
706a81f9-7a39-4e37-acfe-a4cb1467cbec,false,false,"This document pertains specifically to the Environment Agency, which operates in England only. It does not apply to Scotland, as Scotland has its own regulatory body, the Scottish Environment Protection Agency (SEPA), responsible for similar matters."
aac8340a-abab-4b53-b721-ca477ccdb4a9,false,false,"This document pertains to the UK government's transparency and accountability measures regarding special advisers, which are primarily applicable to England and do not explicitly include regulations or practices specific to Scotland."
003b96d5-20dd-4fa3-91df-827df2f953b3,false,false,"This document pertains to the Environment Agency's regulatory activities in England. Environmental regulation in Scotland is managed by the Scottish Environment Protection Agency (SEPA), hence this document does not apply to Scotland."
a6f779a7-243b-4398-804f-8233098526a9,false,false,"This document pertains to the Environment Agency, which operates in England only. Therefore, it does not apply to Scotland, Wales, or Northern Ireland, where different environmental regulatory bodies exist."
baf65d49-9f48-495c-9885-b6d7b6955691,false,false,"This document pertains specifically to the Teachers’ Disciplinary (England) Regulations 2012, which govern teacher conduct in England only and do not apply to Scotland."
97e70ab8-5377-4070-99e1-80991bae2476,false,false,"This document pertains to local authority planned spending on education services in England, and does not mention any specific applicability to Scotland, Wales, or Northern Ireland."
734328fe-30ca-481d-9e52-24c8b7dafae1,false,false,"This document pertains specifically to statistics and practices governed by the Ministry of Justice in England and Wales, and does not apply to Scotland, which has separate legal systems and justice policies."
ad1f3fa2-d435-4fd8-b03e-ad4d1b487717,false,false,"This document specifically pertains to the Environment Agency, which operates primarily in England. It does not cover Scotland, as Scotland has its own environmental regulatory authority, the Scottish Environment Protection Agency (SEPA), and different consultation processes."
cee2fb04-aa3c-4f45-89bb-ab3f633dcc52,false,false,"This document pertains specifically to an academy in North Lincolnshire, which is located in England. As such, it does not apply to Scotland, which has its own education system and admission regulations."
bd3c9e3b-7464-4598-a279-dbea52989a10,false,false,"This document relates to an environmental permit issued by the Environment Agency, which operates in England only. Therefore, it does not apply to Scotland."
e442e477-00f4-426a-bc77-cafabdba02ef,false,false,"This publication specifically focuses on England's school census data, and does not indicate applicability or relevance to Scotland, which has its own education system and data collection processes."
c4927ff4-c586-4768-95a8-7cde147b8ab3,false,false,"This document pertains to applications governed by the Environmental Permitting (England and Wales) Regulations 2016, which specifically applies to England and Wales, not Scotland."
e419c8a3-1a9c-4178-990c-6145d7c86940,false,false,"The document pertains to the Solent and South Downs area, which is primarily located in England. It contains hydrological data specific to English rivers, soils, and reservoirs, and does not address conditions or regulations relevant to Scotland."
56b11571-856a-44e9-9581-045fb7fc9723,false,false,"This report specifically focuses on statistics related to the criminal justice system for England and Wales, and does not apply to Scotland, which has its own distinct legal and criminal justice framework."
aa2ca4b5-9600-4b02-a873-454f92bf7e68,false,false,"This document pertains to permits issued by the Environment Agency, which operates in England. The Industrial Emissions Directive is administered separately in Scotland through the Scottish Environment Protection Agency (SEPA), making this document not applicable to Scotland."
27740b19-3f39-49df-ba2a-345a178e046b,false,false,"This document pertains to an environmental permit application regulated under the Environmental Permitting (England and Wales) Regulations, and therefore it does not apply to Scotland, which has separate regulations for environmental permitting."
f7921fc9-e53b-4c34-9ee3-a1d6bb5491c4,false,false,"This document specifically addresses charity trustee expenses within the context of UK legislation and governance, which is not applicable to Scotland. Scotland has its own regulatory framework pertaining to charities under the Office of the Scottish Charity Regulator (OSCR), which has different guidelines and policies."
a9409475-522c-458c-9098-99ff5e223c45,false,false,"This document specifically refers to the Environment Agency, which operates in England only. It does not apply to Scotland, as environmental regulations and consultations are managed by the Scottish Environment Protection Agency (SEPA) in that region."
3654f704-d664-4f1b-8406-9fb2b0247068,false,false,"This document specifically relates to the Environment Agency, which operates in England only. It does not apply to Scotland, where environmental regulations are managed by the Scottish Environment Protection Agency (SEPA)."
8df5e77d-3d3f-452d-ad17-47ccdf885a28,false,false,The document discusses financial reporting and data specifically related to local authority spending on education services in England and does not include Scotland's education systems or statistics.
6b54240f-7337-4f2c-b8a5-5ebcd78e8466,false,false,"This document focuses on data relevant to England and does not explicitly mention Scotland or include specific statistics or policies applicable to Scotland's fuel poverty measures, which are managed separately."
9d8a33e2-4f3f-42fa-be83-5e5e115ffe4e,false,false,"This document pertains to the regulation of social housing in England and references policies and frameworks specific to England, such as the Tenant Satisfaction Measures (TSMs) and the operational role of the Ministry of Housing, Communities and Local Government (MHCLG). Therefore, it does not apply to Scotland."
e97e21ec-25e4-4fdf-8350-8fabee290958,false,false,"This document pertains to a decision made by Central Bedfordshire Council regarding school admission arrangements, which applies specifically to England. It does not affect Scotland, as education governance is devolved to the Scottish Government, and different policies and regulations are in place."
c1986734-6b62-4d3c-96cf-598034a0e431,false,true,"The document applies to Scotland as it discusses legal aid in relation to domestic abuse, which is relevant in Scottish legal contexts and housing support regulations."
f8b99adf-72d7-4dc3-ac9a-802635d76d8b,true,false,"This document pertains specifically to the Department for Environment, Food and Rural Affairs (Defra), which operates within England. It does not apply to Scotland as data protection and related services are governed by different authorities in Scotland."
f7cf57ae-bb0d-40bc-81f1-5330e487edd1,false,false,"This document pertains specifically to the Environment Agency's functions in England and does not apply to Scotland, which has its own regulatory body, the Scottish Environment Protection Agency (SEPA)."
4138e4a0-08af-42c6-bd06-73504d594854,false,true,"This document discusses rainfall scenarios and their potential impacts on river flows and groundwater, which are relevant to Scotland as part of the UK's climate and environmental concerns. The Met Office forecasts and analyses are applicable across the UK, and understanding these scenarios can inform water management and environmental policy in Scotland."
661ca8e8-43c3-4c18-9aee-94e0017c59cd,false,false,"This document pertains to the Environment Agency, which operates solely in England. Therefore, it does not apply to Scotland, where separate agencies govern environmental matters."
a393cd21-8cc0-473b-a8a1-057bb695c2ef,false,false,"This document applies solely to England and Wales, as it references the Environmental Permitting (England and Wales) Regulations 2016, which do not pertain to Scotland."
78fc8499-28a6-4ded-b76f-badb5fec5a6f,false,false,"This document addresses building safety regulations and transitional arrangements that specifically apply to England and are regulated by the Building Safety Regulator (BSR). Scotland has its own distinct set of building regulations and enforcement mechanisms, which means the content of this document does not apply."
a8008fac-f5c6-40c4-829f-e068fdac302c,false,false,"This guidance primarily pertains to the Local Land Charges register in England and does not apply to Scotland, as Scotland has a separate land registration system governed by different regulations."
0bfd19b6-9919-4b23-984d-a6ea7256e0c2,false,true,"This document outlines regulations under the Building Safety Act 2022, which applies to high-rise buildings across the UK, including Scotland. The Act aims to improve building safety standards and requires compliance from accountable persons managing such properties."
fed6fa58-d927-455d-b405-3fd8a3ff5d23,false,false,"This document pertains specifically to the Environmental Permitting (England and Wales) Regulations 2016, which do not apply to Scotland. Environmental regulation in Scotland is governed by separate legislation and the Scottish Environment Protection Agency (SEPA)."
f32f8b99-03fd-4057-95fd-493491c80725,false,false,"This document specifically discusses registered provider social housing in England and does not include any statistics, guidelines, or regulations that apply to Scotland."
537527bc-8081-4496-a579-f918a2f4b7ab,false,false,"This document pertains specifically to the Environmental Permitting (England and Wales) Regulations 2016, which only apply to England and Wales. Scotland has its own separate regulatory framework for environmental permitting."
10f923ef-484d-417f-a793-236922e6523c,false,false,"This document focuses specifically on homelessness strategy in England, referencing UK government structures and policies that do not apply to Scotland, which has its own distinct legal and policy framework concerning homelessness."
8cd5802b-3352-49ba-bcee-eea52f790d2b,false,true,"The Environment Act 2021 applies across the UK, including Scotland, as it addresses environmental targets that are relevant to improving the natural environment in all parts of the UK."
e9939778-ca21-4529-82f7-f70642e43a92,false,false,"This document pertains to the UK government's practices and procedures, which are not specific to Scotland, as Scotland has its own devolved government and may have separate arrangements for special advisers."
08a4a333-c94a-460d-b9c6-24a4fe5f2b3a,false,false,"This document applies specifically to England and Wales as it is governed by the Environmental Permitting (England and Wales) Regulations 2016. It does not apply to Scotland, which has separate environmental regulations."
de0c86c0-3ff9-4495-8038-c84ca5ecbeb3,false,false,"This report primarily pertains to regulatory activities and financial assessments of private registered providers (PRPs) in England, focusing on housing trends and economic indicators specific to that jurisdiction. It does not indicate applicability to Scotland, where housing and regulatory matters are managed separately by the Scottish Government."
949f50f2-909f-44f8-a74a-e4548f14f3b4,false,false,"This document pertains to management fee limits for retirement leasehold accommodation in England, which is under the jurisdiction of the Ministry of Housing, Communities and Local Government. It does not apply to Scotland, as housing policy is devolved to the Scottish Government."
f9d3f7f5-465b-4ce8-9b4c-e683139ad0b3,false,false,"This regulatory position statement (RPS) primarily applies to operations governed under the Environment Agency, which oversees regulations in England and Wales. Consequently, it does not apply to Scotland, where environmental regulations are managed by the Scottish Environment Protection Agency (SEPA). Scotland has separate environmental permitting requirements."
3f57de56-95e7-4bed-8223-df8892b306aa,false,false,This publication does not specify any particular legislation or guidance that pertains to Scotland or its devolved powers.
bfc59a27-74e5-4972-8637-64bfac1ca9f2,false,false,"This document pertains specifically to environmental permitting regulations applicable to England and Wales, and does not address or apply to Scotland, which has separate environmental regulations."
