id,applies_to_nation_input,applies_to_nation_output,reason
3baf9f5b-c430-4af2-b2be-3f70985443b2,false,true,"This document applies to Scotland as it discusses pesticide regulation, which is devolved and thus relevant for decision-making by the Scottish Government. The UK Government expresses intent to work with devolved administrations, including Scotland, for a consistent approach to pesticide use and regulation."
7e755b06-a6b1-42af-a0e5-3cf664ca0c7b,false,false,"This document pertains to permits issued by the Environment Agency, which operates in England. Therefore, it does not apply to Scotland, as Scotland has its own regulatory body, the Scottish Environment Protection Agency (SEPA), responsible for similar permits."
c1d9c22f-79c5-4bdd-b4bb-1ce1188f1fef,false,false,"This document pertains specifically to the Environment Agency, which operates in England. It does not apply to Scotland, where environmental regulation is managed by the Scottish Environment Protection Agency (SEPA)."
dd43186e-e173-4f48-9b9f-4899d89c902b,false,false,"This document pertains to education data specific to England, particularly key stages 4 and 16 to 18, and does not apply to Scotland's education system, which has different structures and terminology."
ddb5c3ff-9bd0-4fad-905d-867d4cfb7316,false,false,"This document pertains specifically to an environmental permit application regulated by the Environment Agency, which operates in England and Wales only. It does not apply to Scotland as environmental regulation is governed by different authorities in that nation."
fecb5f11-219c-458f-aff4-85da6769a7aa,false,false,"The document specifically pertains to updates from the Office for Health Improvement and Disparities related to England, and it does not mention or apply to Scotland."
c5faf22a-658d-4887-af74-614caab1dd98,false,true,"This publication applies to Scotland as it addresses outcomes for children in need and looked after children, which is a relevant area of practice and social policy within Scottish local authorities and falls under devolved powers related to child welfare."
30743951-d02c-4b8b-83e3-d63e570120a0,false,false,"This document pertains to the Environment Agency, which operates in England only. Therefore, it does not apply to Scotland."
8e8f0c01-8f95-42b8-a1a3-ac8ac6862638,false,false,"This document pertains specifically to the Environment Agency, which operates in England and does not apply to Scotland, where environmental regulation is managed by the Scottish Environment Protection Agency (SEPA)."
b2f34319-d2bf-4f39-aa6e-962a0ee45a49,false,false,"This document specifically outlines guidance for joint targeted area inspections (JTAI) related to children and domestic abuse in England. It does not mention applicability to Scotland, which has its own legislative and policy frameworks for child welfare and domestic abuse."
9f8efff8-18bd-42d7-a41e-06e2117093a0,false,false,"This document pertains specifically to the regulation of social housing in England, addressing the governance and viability of Fairhive Homes Limited. It does not mention or apply to Scottish housing regulations or standards."
fe5c2acb-6152-4f91-a0bd-82312932407b,false,false,"The Crown Prosecution Service (CPS) does not operate in Scotland, where the Crown Office and Procurator Fiscal Service is the equivalent body. Therefore, this document does not apply to Scotland."
584b707e-26ea-42a7-9dcd-82f2be860a3f,false,false,"This document specifically pertains to the regulations and processes governed by the Environment Agency, which operates in England and Wales. Scotland has its own regulatory body, SEPA (Scottish Environment Protection Agency), and separate environmental permitting regulations."
4f678087-b0b7-401c-9ce4-c897adf507ff,true,false,"The document pertains to postcode level gas consumption statistics, which are typically managed by local government bodies and energy regulators. These statistics may not specifically apply to Scotland due to its separate energy regulations and reporting framework compared to the rest of the UK. Therefore, it does not cover Scotland directly."
206cf7e9-1c06-4234-ba93-539c26f0ef77,false,false,"The scheme mentioned is specifically for England only, and therefore does not apply to Scotland."
7542c060-bb2c-4d95-bb2b-965a449b3261,false,false,"This document pertains specifically to England and Wales under the Environmental Permitting (England and Wales) Regulations 2016. It does not apply to Scotland, as Scotland operates under its own legislation for environmental permits."
cd317cd2-6461-4031-a4a5-4b8ee7e885d7,false,false,"The document focuses on smoking services and statistics specifically related to England, with no mention of Scotland or other UK nations. Therefore, it does not apply to Scotland."
5d371bf0-a35a-4257-9ce6-21cabd43f4a0,false,false,"This document is primarily tailored for users in England, referencing specific services and procedures of the Land Registry that apply only in England, thus it does not apply to Scotland."
0f5aaab2-bc46-4f74-aa0e-6ad80445a27d,false,false,"This document specifically pertains to an environmental permit application under the Environmental Permitting (England and Wales) Regulations 2016, which does not apply to Scotland as it has its own regulatory framework for environmental permits."
ae8f4c7f-f5d6-4846-94d6-d79765ea2655,false,false,"The report specifically addresses civil county court cases in England and Wales only, and does not pertain to Scotland, which has a separate legal system."
9fd9f817-8fc6-415b-9a4d-1b2442e8eba5,false,false,The document pertains specifically to the legal aid scheme administered by the Legal Aid Agency for England and Wales and does not mention any legal aid systems or statistics specific to Scotland.
2557197d-b197-483e-9d80-74271801a30f,false,false,"This document pertains to an environmental permit application under the Environmental Permitting (England and Wales) Regulations 2016, which does not apply to Scotland. Environmental regulations in Scotland are governed by separate legislation."
3399c518-faa3-43c6-aad8-e18bcb15b4e2,false,false,"This document pertains specifically to the Environment Agency, which operates in England. Scotland has its own regulatory bodies and procedures for environmental matters, so this document does not apply to Scotland."
dba21d7d-a10b-4f0e-a388-1711ecad716c,false,false,"The document pertains to the regulatory framework for social housing in England, where the Regulator of Social Housing operates. It does not specifically address any regulations or standards applicable to Scotland."
a2ac971e-78e8-4670-a85e-764508b7a16b,false,false,"This document specifically pertains to the Police Ombudsman for Northern Ireland, which is an institution that operates solely within Northern Ireland, and therefore does not apply to Scotland."
19e175ea-94ac-4624-9a30-3c42c52a56ed,false,false,"This document relates specifically to the Environment Agency, which operates in England only. It does not apply to Scotland, where the Scottish Environment Protection Agency (SEPA) manages similar functions."
01d508d6-1be3-436b-892a-f0d94909c4b6,true,true,"This principle of impartiality in the production of official statistics is upheld across the UK, including Scotland, ensuring that statistical outputs are not influenced by political considerations, thus maintaining public trust."
ac6c8319-afc6-4823-9b98-17174f7be84c,false,false,"This document relates specifically to the Environment Agency, which operates in England. Scotland has its own environmental regulatory body, the Scottish Environment Protection Agency (SEPA), and therefore this document does not apply to Scotland."
579a22d2-845d-40b6-8df6-23122af21621,false,false,The document focuses specifically on low traffic neighbourhood (LTN) schemes in England and does not mention any application or relevance to Scotland or its policies.
d772e034-22fb-4344-b8d2-da66738d12ce,false,false,"This document specifically pertains to environmental regulations in England and Wales, as indicated by the reference to the Environmental Permitting (England and Wales) Regulations 2016 and the Environment Agency's role. It does not apply to Scotland."
91c949ef-deb1-4a19-b026-b2afae8b1f09,false,true,"This document applies to Scotland as it pertains to the principles of statistical governance and integrity, which are relevant to all parts of the UK, including Scotland. Official statistics produced in Scotland also adhere to standards of impartiality and independence."
020e64e8-d1ae-40a6-bae6-24c4345c5d8b,false,false,"The document pertains to planning permission processes, which are devolved matters managed by local authorities in Scotland, Northern Ireland, England, and Wales. This specific application and its context do not mention Scottish planning regulations, indicating it is likely a decision relevant to England only."
67fd55a2-8be5-4f94-bbe5-6dd566cf7b1f,false,false,"This document specifically relates to management plans for Protected Landscapes in England, which include National Parks and Areas of Outstanding Natural Beauty (AONBs). It does not apply to Scotland, as Scotland has its own distinct approach and legislation regarding protected areas and land management."
cd3d83f9-65da-481a-afc9-b29aca85c573,false,false,"The document focuses specifically on the youth justice system in England and Wales, and does not pertain to Scotland, which has its own distinct legal and youth justice framework."
28f931a0-ebea-4d2a-bde5-2034aa0ad94f,false,false,"This document pertains specifically to the Environmental Permitting (England and Wales) Regulations 2016, which do not apply to Scotland, as environmental regulations are devolved matters and governed separately in Scotland."
43c26857-371d-4119-972b-81f3e697c9d1,false,false,"This document pertains specifically to the Environment Agency, which operates in England only. Scotland has its own environmental regulatory body, the Scottish Environment Protection Agency (SEPA), and the consultation processes may differ."
a77409a4-80b0-4521-a1f4-6d16a530ecd5,false,false,"This document pertains to specific planning appeals in England and does not apply to Scotland, as planning legislation and processes differ significantly between the two nations."
4b888122-b084-47db-9e9a-4525a9d67419,false,false,"This document specifically refers to DROs (Debt Relief Orders) in England and Wales only, and does not mention Scotland, where different insolvency laws and procedures apply."
5cbda5a3-16b6-44bd-b8c8-498e320be958,false,false,"This document pertains specifically to environmental permitting regulations that apply only in England and Wales, and does not include provisions for Scotland."
fb93fbec-c2d5-4fda-b377-6dfa5eb22f20,false,true,"The Environmental Improvement Plan is a UK-wide initiative that addresses environmental concerns relevant to all nations, including Scotland. Although Scotland has its own environmental policies and governance under the devolved government, the issues of climate change, biodiversity loss, and pollution impacts Scotland's environment, making it relevant for inclusion in the broader UK framework."
b8612ccb-4b13-4440-bc54-c446773839e7,false,false,"The document does not specify any legislative or regulatory differences that would indicate its relevance to Scotland, nor does it mention any Scottish-specific provisions."
789ef8cd-afa5-47c7-8a32-4721e3bfa77f,true,true,"This document pertains to animal health regulations regarding movement licenses, which are applicable across the UK including Scotland. Scottish regulations align with these standards for the control of avian diseases, particularly bird flu."
22e787c8-3a27-4a4d-8ed3-7412c0ba4d2d,false,false,"The statutory framework for biodiversity net gain is specific to England, under legislation such as the Town and Country Planning Act 1990 and the Environment Act 2021. Scotland has its own distinct environmental legislation and planning framework that does not align with this framework."
bef52e22-8703-4eea-8fd3-35ce7054b205,false,false,"This document specifically pertains to the Environmental Agency's regulations in England and Wales, and does not apply to Scotland, which operates under separate environmental legislation."
7fdc5b4c-d41d-4876-b975-d93c5161a70d,false,false,"This document pertains specifically to the functions of regulators in England and does not apply to Scotland, which has its separate regulatory framework for social housing and building safety."
69460b6d-9b4b-4845-b4f0-7ac90504abe5,false,false,"This document pertains specifically to legal procedures under English law, and does not apply to Scotland, which has a distinct legal system and processes."
3a13c300-9966-4434-ab84-1c67609b199a,false,false,"This document relates to the Justice and Security Act 2013, which is specific to England and Wales. It does not apply to Scotland, as legal procedures and legislative matters are devolved to the Scottish Parliament."
ad4af918-aa20-4c4e-92c4-e5a19e069c66,false,false,"This publication specifically refers to the prison performance metrics managed by the Ministry of Justice, which oversees prisons in England and Wales. Therefore, it does not apply to Scotland, which has its own legal and prison system."
5837ff5e-5bfa-4ede-852a-ce9855ddce98,false,false,"This document pertains to regulations enforced by the Environment Agency in England, indicating that it does not apply to Scotland, which has its own regulatory body, the Scottish Environment Protection Agency (SEPA)."
37077fb6-3a9e-4b52-b6bb-79f3d5976ceb,true,true,"The report pertains to livestock and agricultural data, which are relevant to Scotland's farming industry and agricultural practices, thus making it applicable."
e37a7a02-d443-487f-ae61-8f21da1898e2,false,false,"This document pertains specifically to the Teachers' Disciplinary (England) Regulations 2012, which apply only to England and do not extend to Scotland or other UK nations."
247a3ceb-ce22-4974-b6bb-c4581599e276,false,false,"This document pertains primarily to England's education funding processes and regulations, and it does not indicate applicability to Scotland, as education funding and policy are devolved matters in Scotland."
fa6a04f2-d180-49d2-b199-3876c7ff4764,false,false,"This planning application pertains to a site in Bristol, England, and is managed under the local authority regulations applicable in England. It does not apply to Scotland."
b1ea1278-28af-4cbe-b484-e84c5d3cbe47,true,false,"The document specifically discusses Universal Credit, which is a reserved matter in the UK and is applied uniformly across England, Wales, Scotland, and Northern Ireland. However, it does not provide Scotland-specific data or context, rendering it not directly applicable to Scotland's specific framework for welfare or benefit statistics."
2f37f6c2-f31c-4146-ba77-a12f3d637761,false,true,"Bu metin, NHS servikal taramasıyla ilgili olduğundan, Birleşik Krallık'ın özellikle İngiltere ve İskoçya'da geçerlidir. İskoçya, NHS hizmetlerini kendi düzenlemeleriyle sunarak, tarama programlarından faydalanan kadın ve bireyleri kapsamaktadır."
082044c9-c650-42c0-938c-43af006e2841,false,true,"This document provides information on the shingles vaccination that is relevant for adults with learning disabilities across the UK, including Scotland, where public health initiatives encompass vaccination programs. Therefore, it applies to Scotland as part of the wider UK healthcare framework."
38a5c6e8-4619-40c7-8cba-dada58e8a16d,false,false,"This document primarily addresses charity governance and donation management, which is regulated under UK-wide charity law applicable to England and Wales. Scotland has its own distinct charity law framework and regulatory body, meaning this guidance is not applicable there."
0fad70d7-547e-4bfe-8cb5-5d41c5c94ff0,false,false,"The Equality Act 2010 and its associated regulations apply primarily to England, Wales, and Northern Ireland. Scotland has its own legislation regarding equality and employment, and is not subject to the same requirements under this act."
c88c41a9-c05f-4afa-8461-98678394d9e6,false,false,The statement does not provide specific information about applicability to Scotland or any other UK nation. It is a general remark regarding access without geographical context.
0360ccde-8393-41d8-8931-df4c361b83ce,false,false,"This document pertains specifically to England and the Teachers' Disciplinary Regulations that apply there. It does not reference or indicate any application to Scotland, which has its own separate education policies and procedures."
7eb3fa17-1276-462b-bc21-d5d3034437f0,false,false,"The document primarily discusses methane emissions from landfills, a topic more relevant to environmental policy and regulation in England, Wales, and Northern Ireland. Scotland has separate environmental regulations and policies, which may not align directly with this document's focus."
72353d66-d7e4-4bc6-a848-654b240a4dfd,false,false,"The Environment Agency operates primarily in England. Therefore, the document does not apply to Scotland, which has its own regulatory body, the Scottish Environment Protection Agency (SEPA), for environmental matters."
fc87b2c0-872d-402b-a76c-23868fa10080,false,false,"This document concerns the Post Office (Horizon System) Offences Act 2024, which specifically addresses convictions imposed in England and Wales. Convictions in Scotland are not covered by this Act and fall under separate legislation."
e61be53b-11e0-425f-9495-c97e7cca755c,false,false,This document focuses on rural flood resilience initiatives in England specifically and does not address issues or partnerships relevant to Scotland.
dfc03882-4e40-49f9-a068-4f859f9a3706,false,false,"This document does not specifically reference policies or laws that are unique to Scotland, and therefore it is not applicable to Scotland."
4de45dcd-e949-4b91-b7d1-bb7b3c1de037,false,false,"This document pertains to the Environmental Permitting (England and Wales) Regulations 2016, and therefore, it does not apply to Scotland, which has its own distinct regulatory framework for environmental permits."
b00a1c58-4eed-4d26-8ee2-4b57025ba22e,false,false,"This document discusses UK-wide initiatives and governance regarding data security, which do not specifically mention or apply to any distinct policies or regulations in Scotland."
b6d9acdd-cf04-4eff-9380-0e9778818d5d,false,false,"This document pertains to the Environment Agency, which operates primarily in England. It does not apply to Scotland as water management is overseen by the Scottish Environment Protection Agency (SEPA) in Scotland."
fba5b58e-b122-46db-92c2-9d0b9ca543c5,false,false,"This document pertains specifically to the Environmental Permitting Regulations in England and Wales, and does not apply to Scotland, which has its own distinct environmental regulations and permitting processes."
7fafcec2-9ede-4326-a215-3c0ed21a52e5,false,false,"This document specifically discusses student support for applicants and students in Northern Ireland and does not provide information or statistics relevant to Scotland. Therefore, it does not apply to Scotland."
bb8cfa4c-a752-406f-800d-e0d167241081,false,false,"The Social Housing Decarbonisation Fund (SHDF) is a UK Government initiative primarily focused on England. It does not include specific provisions or applicability for Scotland, which has separate regulations and funding mechanisms for social housing and energy efficiency measures."
235f844a-703f-434d-952a-74e330d399ad,false,false,"This document pertains specifically to the Environment Agency, which governs matters in England. It does not apply to Scotland as it has its own environmental authority, the Scottish Environment Protection Agency (SEPA), that manages similar issues."
d86470e3-34db-4bc1-8877-a77f25255fc0,true,true,"This document discusses elements of disability services and British Sign Language (BSL) that may also impact Scotland, particularly in relation to accessibility and employment for Deaf individuals, which resonates with Scotland's commitments to inclusive practices."
416ec820-9b8d-4c62-b6a8-a410a5571436,false,false,"The document specifically pertains to the statistics and operations of the probation service in England and Wales, and does not include data or governance related to Scotland."
83c3178a-a72e-4f76-9b33-5fbb8e2530a5,false,false,"This document only pertains to the Environmental Permitting (England and Wales) Regulations 2016, which do not apply to Scotland. Environmental legislation in Scotland is governed by different regulations and is managed by the Scottish Environment Protection Agency (SEPA)."
1fca77c4-8fba-406d-af59-b0b918eac4d8,false,false,"This document pertains specifically to environmental permitting under the regulations applicable in England and Wales, and does not apply to Scotland."
351c6f5c-ec9a-40dd-8e53-74948fc97527,false,false,"This document specifically pertains to the Environmental Permitting (England and Wales) Regulations 2016, which do not apply to Scotland. Scotland has its own environmental regulatory framework and authority, separate from those of England and Wales."
6d19f2a8-3e44-4b21-a62e-0a79765b2aa8,false,false,"This document pertains strictly to local authorities in England and does not include provisions for Scotland, as it references legislation and funding specific to England's adult social care system."
4cb950e6-6f30-43ae-974f-722e867b1649,false,false,"This document specifically addresses initiatives and policies related to the Forestry Commission in England, and does not mention any applicability or relevance to Scotland or other UK nations."
4f9ca507-7f56-47eb-af4f-37f374168888,false,false,"This document pertains specifically to the Environment Agency, which operates in England. It does not apply to Scotland, where environmental matters are managed by the Scottish Environment Protection Agency (SEPA) under separate regulations."
500a2d47-9eb5-4bca-9e6a-760fedc2aefc,false,false,"The document specifically discusses data related to Patients, General Practitioners, and GP Practices in Northern Ireland. Therefore, it does not apply to Scotland."
4dc94201-e9a3-4512-92c8-778969e0534a,false,false,"This document specifically relates to the Environment Agency's operations in England only, and does not apply to Scotland, as Scotland has its own environmental regulatory framework and agency."
a1bc0cc4-51bb-4c44-b3e3-7652bdac47d0,false,false,"This document primarily discusses data and indicators specific to England, particularly referencing the GP Patient Survey and health profiles based on NHS data, which do not apply to Scotland or consider its distinct healthcare system."
fdbd5b81-03a6-475b-bf76-5af42d4453bf,false,false,"This document pertains specifically to the Environment Agency, which operates in England only. Similar functions in Scotland are carried out by the Scottish Environment Protection Agency (SEPA), so this document does not apply to Scotland."
9fecd25d-598c-4746-b122-965c423c90ce,false,false,"This document relates to the Environment Agency, which operates solely in England. Therefore, it does not apply to Scotland, which has its own environmental regulatory framework."
858490b2-f538-498f-9d8f-2eaf3a2c25b9,false,false,"The document specifically pertains to local authority revenue expenditure and financing, which is a matter mainly of concern at the local government level in England and Wales, and does not directly mention Scotland's local authorities or its financial frameworks."
e34f65ae-5c73-4971-aa8c-4767895cd97e,false,false,"The document pertains specifically to Health and Social Care (HSC) vacancies, which are primarily relevant to Northern Ireland. It does not apply to Scotland as health and social care services operate under different frameworks and regulations."
fee36e84-ce19-4ca2-8032-f8486ef9f912,false,false,"The document specifically discusses the government's response in conjunction with NHS England and the Care Quality Commission, which operate primarily in England. It does not reference or address mental health inpatient settings in Scotland, indicating that it does not apply to Scotland."
0ad4575a-30ce-4b92-b329-87f053192280,false,false,"This document primarily pertains to planning and infrastructure matters, which are devolved issues handled differently across the UK. The specific legal and regulatory framework for solar farms in Scotland is separate from that of England, where the report originates."
5a280572-01a6-4e2a-a70f-b071ee1bcef8,false,false,"This document pertains specifically to the Environmental Permitting Regulations for England and Wales, and does not apply to Scotland, which has separate environmental regulatory frameworks."
42a4979b-a64b-44c6-adc5-6530c9853c7a,false,false,"This document specifically pertains to the Environment Agency, which operates in England only. It does not apply to Scotland, as environmental regulation is managed differently under separate devolved authorities."
13357cac-7c6e-4484-bcda-85ffde6653de,false,false,"This document pertains specifically to England and Wales, as it references the Environmental Permitting (England and Wales) Regulations 2016, which do not apply to Scotland."
ba76cd45-79d1-461d-8485-b9d021be00a8,false,false,"This document focuses on unpaid work as a sentencing option in England and does not pertain to Scotland, where distinct legal processes and sentencing frameworks exist."
9190c4d3-1ac6-4598-9322-5106b266ab90,false,false,"This document is specific to the Environment Agency, which operates in England. It does not apply to Scotland, as Scotland has its own environmental regulatory body, the Scottish Environment Protection Agency (SEPA), which manages similar functions."
